movieId,title,genres,actors,rating
1290,Some Kind of Wonderful (1987),Drama|Romance,"Brad Pitt, Clint Eastwood",6.6
1291,Indiana Jones and the Last Crusade (1989),Action|Adventure,"Scarlett Johansson, Leonardo DiCaprio",7.4
1292,Being There (1979),Comedy|Drama,"Audrey Hepburn, Clint Eastwood",9.5
1293,Gandhi (1982),Drama,Meryl Streep,9.0
1295,"Unbearable Lightness of Being, The (1988)",Drama,Denzel Washington,4.0
1296,"Room with a View, A (1986)",Drama|Romance,"Morgan Freeman, Jack Nicholson, Tom Cruise",4.8
1297,Real Genius (1985),Comedy,"Brad Pitt, Tom Cruise, Leonardo DiCaprio",8.6
1298,Pink Floyd: The Wall (1982),Drama|Musical,"Clint Eastwood, Leonardo DiCaprio",9.0
1299,"Killing Fields, The (1984)",Drama|War,"Christopher Nolan, Emma Watson, Angelina Jolie",9.0
1300,My Life as a Dog (Mitt liv som hund) (1985),Comedy|Drama,Emma Watson,8.6
1301,Forbidden Planet (1956),Drama|Sci-Fi,"Morgan Freeman, Scarlett Johansson, Audrey Hepburn",9.4
1302,Field of Dreams (1989),Children|Drama|Fantasy,"Morgan Freeman, Tom Cruise, Clint Eastwood",6.2
1303,"Man Who Would Be King, The (1975)",Adventure|Drama,Tom Cruise,5.0
1304,Butch Cassidy and the Sundance Kid (1969),Action|Western,Al Pacino,5.5
1305,"Paris, Texas (1984)",Drama|Romance,"Robert De Niro, Steven Spielberg",8.7
1306,Until the End of the World (Bis ans Ende der Welt) (1991),Adventure|Drama|Sci-Fi,"Steven Spielberg, Tom Cruise",3.1
1307,When Harry Met Sally... (1989),Comedy|Romance,Jennifer Lawrence,7.0
1308,I Shot a Man in Vegas (1995),Comedy,"Brad Pitt, Al Pacino",7.2
1309,Parallel Sons (1995),Drama|Romance,"Tom Cruise, Jack Nicholson, Brad Pitt",4.0
1310,Hype! (1996),Documentary,Tom Cruise,4.2
1311,Santa with Muscles (1996),Comedy,"Clint Eastwood, Scarlett Johansson, Emma Watson",7.3
1312,Female Perversions (1996),Drama,"Brad Pitt, Robert De Niro, Scarlett Johansson",3.2
1313,Mad Dog Time (1996),Crime,Martin Scorsese,8.0
1314,Breathing Room (1996),Romance,"Brad Pitt, Johnny Depp",4.7
1315,Paris Was a Woman (1995),Documentary,"Audrey Hepburn, Tom Hanks",8.7
1316,Anna (1996),Drama,"Jack Nicholson, Martin Scorsese",4.5
1317,I'm Not Rappaport (1996),Comedy,"Denzel Washington, Johnny Depp, Robert De Niro",5.8
1318,Blue Juice (1995),Comedy|Drama,"Martin Scorsese, Morgan Freeman",5.7
1319,Kids of Survival (1996),Documentary,Tom Cruise,5.4
1320,Alien³ (a.k.a. Alien 3) (1992),Action|Horror|Sci-Fi|Thriller,Johnny Depp,9.3
1321,"American Werewolf in London, An (1981)",Comedy|Horror|Thriller,"Audrey Hepburn, Al Pacino",8.2
1322,Amityville 1992: It's About Time (1992),Horror,"Leonardo DiCaprio, Robert De Niro, Morgan Freeman",9.3
1323,Amityville 3-D (1983),Horror,"Meryl Streep, Audrey Hepburn, Tom Hanks",5.2
1324,Amityville: Dollhouse (1996),Horror,"Audrey Hepburn, Leonardo DiCaprio",7.5
1325,Amityville: A New Generation (1993),Horror,Meryl Streep,4.1
1326,Amityville II: The Possession (1982),Horror,"Jack Nicholson, Clint Eastwood, Brad Pitt",6.4
1327,"Amityville Horror, The (1979)",Drama|Horror|Mystery|Thriller,Martin Scorsese,8.9
1328,"Amityville Curse, The (1990)",Horror,"Scarlett Johansson, Tom Cruise",9.2
1329,Blood for Dracula (Andy Warhol's Dracula) (1974),Horror,"Emma Watson, Christopher Nolan",9.9
1330,April Fool's Day (1986),Horror,"Tom Hanks, Johnny Depp, Al Pacino",3.7
1331,Audrey Rose (1977),Horror,Emma Watson,3.2
1332,"Believers, The (1987)",Horror|Thriller,"Jack Nicholson, Morgan Freeman",7.2
1333,"Birds, The (1963)",Horror|Thriller,"Clint Eastwood, Morgan Freeman, Christopher Nolan",8.3
1334,"Blob, The (1958)",Horror|Sci-Fi,"Leonardo DiCaprio, Brad Pitt, Tom Cruise",3.1
1335,Blood Beach (1981),Horror|Mystery,"Denzel Washington, Al Pacino",9.7
1336,Body Parts (1991),Horror|Thriller,"Angelina Jolie, Robert De Niro",6.9
1337,"Body Snatcher, The (1945)",Drama|Horror|Thriller,Meryl Streep,4.5
1339,Dracula (Bram Stoker's Dracula) (1992),Fantasy|Horror|Romance|Thriller,Tom Hanks,4.5
1340,"Bride of Frankenstein, The (Bride of Frankenstein) (1935)",Drama|Horror|Sci-Fi,Steven Spielberg,9.6
1341,Burnt Offerings (1976),Horror,"Steven Spielberg, Leonardo DiCaprio",3.3
1342,Candyman (1992),Horror|Thriller,"Clint Eastwood, Morgan Freeman, Steven Spielberg",4.6
1343,Cape Fear (1991),Thriller,Jack Nicholson,3.4
1344,Cape Fear (1962),Crime|Drama|Thriller,Scarlett Johansson,7.3
1345,Carrie (1976),Drama|Fantasy|Horror|Thriller,"Christopher Nolan, Johnny Depp",4.3
1346,Cat People (1982),Drama|Fantasy|Horror,Christopher Nolan,4.5
1347,"Nightmare on Elm Street, A (1984)",Horror|Thriller,"Martin Scorsese, Denzel Washington",9.3
1348,"Nosferatu (Nosferatu, eine Symphonie des Grauens) (1922)",Horror,"Angelina Jolie, Denzel Washington, Tom Cruise",8.7
1349,Vampire in Venice (Nosferatu a Venezia) (Nosferatu in Venice) (1986),Horror,"Meryl Streep, Jennifer Lawrence, Denzel Washington",6.0
1350,"Omen, The (1976)",Horror|Mystery|Thriller,"Meryl Streep, Brad Pitt",8.7
1351,Blood and Wine (Blood & Wine) (1996),Crime|Drama|Thriller,Morgan Freeman,3.1
1352,Albino Alligator (1996),Crime|Thriller,"Robert De Niro, Leonardo DiCaprio, Johnny Depp",9.5
1353,"Mirror Has Two Faces, The (1996)",Comedy|Drama|Romance,"Leonardo DiCaprio, Martin Scorsese",6.8
1354,Breaking the Waves (1996),Drama|Mystery,Steven Spielberg,5.4
1355,Nightwatch (1997),Horror|Thriller,Christopher Nolan,5.5
1356,Star Trek: First Contact (1996),Action|Adventure|Sci-Fi|Thriller,"Johnny Depp, Denzel Washington, Tom Hanks",3.5
1357,Shine (1996),Drama|Romance,"Emma Watson, Johnny Depp, Meryl Streep",6.9
1358,Sling Blade (1996),Drama,"Denzel Washington, Christopher Nolan, Clint Eastwood",6.0
1359,Jingle All the Way (1996),Children|Comedy,Audrey Hepburn,8.1
1360,Identification of a Woman (Identificazione di una donna) (1982),Drama,"Jennifer Lawrence, Tom Cruise, Leonardo DiCaprio",8.1
1361,Paradise Lost: The Child Murders at Robin Hood Hills (1996),Documentary,"Tom Cruise, Morgan Freeman",6.7
1363,"Preacher's Wife, The (1996)",Drama,"Brad Pitt, Jack Nicholson, Martin Scorsese",5.3
1364,Zero Kelvin (Kjærlighetens kjøtere) (1995),Drama,Tom Hanks,4.9
1365,Ridicule (1996),Drama,"Robert De Niro, Al Pacino",4.1
1366,"Crucible, The (1996)",Drama,"Meryl Streep, Jack Nicholson, Morgan Freeman",4.7
1367,101 Dalmatians (1996),Adventure|Children|Comedy,"Robert De Niro, Martin Scorsese",6.9
1368,"Forbidden Christ, The (Cristo proibito, Il) (1950)",Drama,"Leonardo DiCaprio, Denzel Washington, Al Pacino",3.2
1369,I Can't Sleep (J'ai pas sommeil) (1994),Drama|Thriller,"Clint Eastwood, Angelina Jolie",3.7
1370,Die Hard 2 (1990),Action|Adventure|Thriller,"Steven Spielberg, Brad Pitt, Martin Scorsese",8.7
1371,Star Trek: The Motion Picture (1979),Adventure|Sci-Fi,Martin Scorsese,8.7
1372,Star Trek VI: The Undiscovered Country (1991),Action|Mystery|Sci-Fi,Al Pacino,5.8
1373,Star Trek V: The Final Frontier (1989),Action|Sci-Fi,"Angelina Jolie, Scarlett Johansson, Robert De Niro",8.0
1374,Star Trek II: The Wrath of Khan (1982),Action|Adventure|Sci-Fi|Thriller,"Emma Watson, Denzel Washington, Jack Nicholson",3.7
1375,Star Trek III: The Search for Spock (1984),Action|Adventure|Sci-Fi,"Audrey Hepburn, Tom Cruise",6.4
1376,Star Trek IV: The Voyage Home (1986),Adventure|Comedy|Sci-Fi,Audrey Hepburn,4.7
1377,Batman Returns (1992),Action|Crime,"Scarlett Johansson, Denzel Washington, Al Pacino",9.2
1378,Young Guns (1988),Action|Comedy|Western,"Brad Pitt, Christopher Nolan",6.6
1379,Young Guns II (1990),Action|Western,Al Pacino,6.6
1380,Grease (1978),Comedy|Musical|Romance,"Denzel Washington, Leonardo DiCaprio",9.2
1381,Grease 2 (1982),Comedy|Musical|Romance,"Jennifer Lawrence, Robert De Niro",3.6
1382,Marked for Death (1990),Action|Drama,"Jennifer Lawrence, Morgan Freeman",7.6
1383,Adrenalin: Fear the Rush (1996),Action|Sci-Fi,Clint Eastwood,6.6
1384,"Substance of Fire, The (1996)",Drama,Robert De Niro,9.7
1385,Under Siege (1992),Action|Drama|Thriller,"Leonardo DiCaprio, Al Pacino",5.5
1386,Terror in a Texas Town (1958),Western,"Morgan Freeman, Audrey Hepburn",6.9
1387,Jaws (1975),Action|Horror,"Morgan Freeman, Steven Spielberg",7.8
1388,Jaws 2 (1978),Horror|Thriller,Emma Watson,5.9
1389,Jaws 3-D (1983),Action|Horror,"Al Pacino, Clint Eastwood, Angelina Jolie",6.1
1390,My Fellow Americans (1996),Comedy,"Clint Eastwood, Angelina Jolie, Denzel Washington",7.9
1391,Mars Attacks! (1996),Action|Comedy|Sci-Fi,"Morgan Freeman, Jack Nicholson, Johnny Depp",8.4
1392,Citizen Ruth (1996),Comedy|Drama,Steven Spielberg,7.4
1393,Jerry Maguire (1996),Drama|Romance,"Christopher Nolan, Johnny Depp",5.8
1394,Raising Arizona (1987),Comedy,"Emma Watson, Denzel Washington, Brad Pitt",8.2
1395,Tin Men (1987),Comedy|Drama,Clint Eastwood,8.5
1396,Sneakers (1992),Action|Comedy|Crime|Drama|Sci-Fi,"Christopher Nolan, Jennifer Lawrence",5.5
1397,Bastard Out of Carolina (1996),Drama,Leonardo DiCaprio,4.8
1398,In Love and War (1996),Romance|War,"Al Pacino, Meryl Streep",7.7
1399,Marvin's Room (1996),Drama,Al Pacino,3.4
1400,Somebody is Waiting (1996),Drama,"Leonardo DiCaprio, Emma Watson, Clint Eastwood",4.0
1401,Ghosts of Mississippi (1996),Drama,"Leonardo DiCaprio, Steven Spielberg, Martin Scorsese",7.0
1404,Night Falls on Manhattan (1996),Crime|Drama,Jennifer Lawrence,5.0
1405,Beavis and Butt-Head Do America (1996),Adventure|Animation|Comedy|Crime,"Steven Spielberg, Al Pacino, Jennifer Lawrence",8.1
1406,La Cérémonie (1995),Crime|Drama|Mystery|Thriller,Meryl Streep,8.5
1407,Scream (1996),Comedy|Horror|Mystery|Thriller,"Martin Scorsese, Al Pacino, Brad Pitt",8.4
1408,"Last of the Mohicans, The (1992)",Action|Romance|War|Western,"Al Pacino, Jack Nicholson",9.2
1409,Michael (1996),Comedy|Drama|Fantasy|Romance,"Denzel Washington, Jack Nicholson, Morgan Freeman",5.2
1410,"Evening Star, The (1996)",Comedy|Drama,Jack Nicholson,8.5
1411,Hamlet (1996),Crime|Drama|Romance,Brad Pitt,5.2
1412,Some Mother's Son (1996),Drama,Robert De Niro,7.1
1413,"Whole Wide World, The (1996)",Drama,"Jack Nicholson, Al Pacino, Robert De Niro",8.7
1414,Mother (1996),Comedy,"Jack Nicholson, Tom Cruise",3.9
1415,"Thieves (Voleurs, Les) (1996)",Crime|Drama|Romance,"Tom Hanks, Jennifer Lawrence",6.5
1416,Evita (1996),Drama|Musical,"Clint Eastwood, Meryl Streep",9.1
1417,"Portrait of a Lady, The (1996)",Drama,Tom Hanks,3.4
1419,Walkabout (1971),Adventure|Drama,"Clint Eastwood, Morgan Freeman, Audrey Hepburn",4.6
1420,Message to Love: The Isle of Wight Festival (1996),Documentary,Al Pacino,5.5
1421,Grateful Dead (1995),Documentary,"Martin Scorsese, Christopher Nolan",9.2
1422,Murder at 1600 (1997),Crime|Drama|Mystery|Thriller,"Morgan Freeman, Audrey Hepburn, Christopher Nolan",8.2
1423,Hearts and Minds (1996),Drama,Clint Eastwood,6.1
1424,Inside (1996),Action,"Tom Hanks, Al Pacino",5.4
1425,Fierce Creatures (1997),Comedy,"Jennifer Lawrence, Johnny Depp",9.9
1426,Zeus and Roxanne (1997),Children,"Steven Spielberg, Al Pacino, Emma Watson",6.1
1427,Turbulence (1997),Action|Thriller,"Johnny Depp, Emma Watson",4.7
1428,Angel Baby (1995),Drama,"Christopher Nolan, Robert De Niro, Audrey Hepburn",7.3
1429,First Strike (Police Story 4: First Strike) (Ging chaat goo si 4: Ji gaan daan yam mo) (1996),Action|Adventure|Comedy|Thriller,"Al Pacino, Johnny Depp",7.6
1430,Underworld (1996),Comedy|Thriller,Jack Nicholson,3.5
1431,Beverly Hills Ninja (1997),Action|Comedy,"Scarlett Johansson, Angelina Jolie",6.4
1432,Metro (1997),Action|Comedy|Crime|Drama|Thriller,"Jennifer Lawrence, Tom Hanks",4.2
1433,The Machine (1994),Horror|Sci-Fi|Thriller,"Tom Cruise, Martin Scorsese, Angelina Jolie",4.9
1434,"Stranger, The (1994)",Action,Johnny Depp,5.1
1436,Falling in Love Again (1980),Comedy,Jennifer Lawrence,4.3
1437,"Cement Garden, The (1993)",Drama,Jack Nicholson,8.1
1438,Dante's Peak (1997),Action|Thriller,"Jennifer Lawrence, Leonardo DiCaprio, Audrey Hepburn",9.6
1439,Meet Wally Sparks (1997),Comedy,"Clint Eastwood, Scarlett Johansson, Martin Scorsese",9.6
1440,Amos & Andrew (1993),Comedy,Clint Eastwood,4.4
1441,Benny & Joon (1993),Comedy|Romance,"Denzel Washington, Tom Hanks, Robert De Niro",9.1
1442,Prefontaine (1997),Drama,Angelina Jolie,9.9
1443,"Tickle in the Heart, A (1996)",Documentary,Robert De Niro,8.3
1444,Guantanamera (1994),Comedy,"Martin Scorsese, Jack Nicholson, Meryl Streep",9.2
1445,McHale's Navy (1997),Comedy|War,Tom Cruise,9.2
1446,Kolya (Kolja) (1996),Comedy|Drama,"Leonardo DiCaprio, Tom Cruise",4.9
1447,Gridlock'd (1997),Crime,"Meryl Streep, Steven Spielberg, Tom Cruise",3.7
1448,Fire on the Mountain (1996),Documentary,Meryl Streep,7.7
1449,Waiting for Guffman (1996),Comedy,"Johnny Depp, Audrey Hepburn",9.0
1450,Prisoner of the Mountains (Kavkazsky plennik) (1996),War,"Tom Cruise, Martin Scorsese, Denzel Washington",9.9
1453,"Beautician and the Beast, The (1997)",Comedy|Romance,Clint Eastwood,8.2
1454,SubUrbia (1997),Comedy|Drama,Johnny Depp,6.4
1455,Hotel de Love (1996),Comedy|Romance,"Brad Pitt, Clint Eastwood, Angelina Jolie",6.5
1456,"Pest, The (1997)",Comedy,Meryl Streep,7.3
1457,Fools Rush In (1997),Comedy|Drama|Romance,"Robert De Niro, Jennifer Lawrence",4.2
1458,Touch (1997),Drama|Fantasy|Romance,Morgan Freeman,4.1
1459,Absolute Power (1997),Mystery|Thriller,"Martin Scorsese, Jack Nicholson",3.8
1460,That Darn Cat (1997),Children|Comedy|Mystery,"Emma Watson, Johnny Depp, Martin Scorsese",6.3
1461,Vegas Vacation (National Lampoon's Las Vegas Vacation) (1997),Comedy,Jennifer Lawrence,5.5
1462,Unforgotten: Twenty-Five Years After Willowbrook (1996),Documentary,Jack Nicholson,4.6
1463,That Old Feeling (1997),Comedy|Romance,Leonardo DiCaprio,3.3
1464,Lost Highway (1997),Crime|Drama|Fantasy|Film-Noir|Mystery|Romance,Johnny Depp,3.3
1465,Rosewood (1997),Action|Drama,Jack Nicholson,8.2
1466,Donnie Brasco (1997),Crime|Drama,Johnny Depp,6.8
1467,Salut cousin! (1996),Comedy|Drama,"Emma Watson, Denzel Washington",6.6
1468,Booty Call (1997),Comedy|Romance,"Angelina Jolie, Martin Scorsese",7.9
1470,Rhyme & Reason (1997),Documentary,"Johnny Depp, Meryl Streep, Denzel Washington",6.8
1471,Boys Life 2 (1997),Drama,"Tom Hanks, Tom Cruise",5.7
1472,City of Industry (1997),Crime|Thriller,"Clint Eastwood, Emma Watson",8.2
1473,Best Men (1997),Action|Comedy|Crime|Drama,Martin Scorsese,8.6
1474,Jungle2Jungle (a.k.a. Jungle 2 Jungle) (1997),Children|Comedy,Jennifer Lawrence,5.9
1475,Kama Sutra: A Tale of Love (1996),Romance,Leonardo DiCaprio,3.6
1476,Private Parts (1997),Comedy|Drama,"Brad Pitt, Clint Eastwood",9.5
1477,Love Jones (1997),Romance,"Al Pacino, Christopher Nolan",3.4
1479,"Saint, The (1997)",Action|Romance|Sci-Fi|Thriller,"Jack Nicholson, Meryl Streep",3.2
1480,Smilla's Sense of Snow (1997),Drama|Thriller,"Audrey Hepburn, Denzel Washington, Christopher Nolan",9.8
1482,"Van, The (1996)",Comedy|Drama,"Meryl Streep, Al Pacino, Christopher Nolan",5.8
1483,Crash (1996),Drama|Thriller,"Brad Pitt, Robert De Niro",5.0
1484,"Daytrippers, The (1996)",Comedy|Drama|Mystery|Romance,"Jennifer Lawrence, Al Pacino, Morgan Freeman",4.5
1485,Liar Liar (1997),Comedy,"Morgan Freeman, Clint Eastwood, Angelina Jolie",7.0
1486,"Quiet Room, The (1996)",Drama,Audrey Hepburn,4.1
1487,Selena (1997),Drama|Musical,Tom Hanks,8.7
1488,"Devil's Own, The (1997)",Action|Drama|Thriller,"Robert De Niro, Denzel Washington",3.0
1489,Cats Don't Dance (1997),Animation|Children|Musical,Martin Scorsese,8.3
1490,B*A*P*S (1997),Comedy,Audrey Hepburn,3.5
1493,Love and Other Catastrophes (1996),Romance,Steven Spielberg,3.8
1495,Turbo: A Power Rangers Movie (1997),Action|Adventure|Children,"Denzel Washington, Leonardo DiCaprio, Jennifer Lawrence",8.7
1496,Anna Karenina (1997),Drama|Romance,Tom Cruise,5.8
1497,Double Team (1997),Action,"Al Pacino, Morgan Freeman",3.2
1498,Inventing the Abbotts (1997),Drama|Romance,Emma Watson,9.7
1499,Anaconda (1997),Action|Adventure|Thriller,"Scarlett Johansson, Morgan Freeman, Johnny Depp",4.9
1500,Grosse Pointe Blank (1997),Comedy|Crime|Romance,Emma Watson,4.2
1501,Keys to Tulsa (1997),Crime,Clint Eastwood,10.0
1502,Kissed (1996),Drama|Romance,"Emma Watson, Tom Cruise",7.1
1503,8 Heads in a Duffel Bag (1997),Comedy,"Morgan Freeman, Denzel Washington",7.0
1504,Hollow Reed (1996),Drama,"Leonardo DiCaprio, Brad Pitt, Tom Hanks",9.1
1507,Paradise Road (1997),Drama|War,Tom Hanks,5.5
1508,Traveller (1997),Drama,"Angelina Jolie, Audrey Hepburn",8.5
1509,All Over Me (1997),Drama,"Clint Eastwood, Al Pacino",7.3
1510,"Brother's Kiss, A (1997)",Drama,"Scarlett Johansson, Jack Nicholson, Leonardo DiCaprio",5.9
1511,"Chef in Love, A (Shekvarebuli kulinaris ataserti retsepti) (1997)",Comedy|Romance,Martin Scorsese,7.8
1513,Romy and Michele's High School Reunion (1997),Comedy,Tom Cruise,9.6
1514,Temptress Moon (Feng Yue) (1996),Romance,Brad Pitt,3.6
1515,Volcano (1997),Action|Drama|Thriller,Morgan Freeman,5.1
1516,Children of the Revolution (1996),Comedy,"Leonardo DiCaprio, Meryl Streep, Johnny Depp",9.8
1517,Austin Powers: International Man of Mystery (1997),Action|Adventure|Comedy,Morgan Freeman,5.0
1518,Breakdown (1997),Action|Thriller,"Christopher Nolan, Clint Eastwood, Johnny Depp",4.4
1519,Broken English (1996),Drama,"Morgan Freeman, Denzel Washington, Tom Cruise",4.4
1520,Commandments (1997),Romance,Al Pacino,9.1
1522,Ripe (1996),Drama,Jack Nicholson,4.1
1523,"Truth or Consequences, N.M. (1997)",Action|Crime|Romance,"Emma Watson, Morgan Freeman",9.9
1524,"Turning, The (1992)",Drama,"Angelina Jolie, Clint Eastwood",7.3
1525,Warriors of Virtue (1997),Action|Adventure|Children|Fantasy,"Meryl Streep, Martin Scorsese",4.7
1526,Fathers' Day (1997),Comedy,Morgan Freeman,4.6
1527,"Fifth Element, The (1997)",Action|Adventure|Comedy|Sci-Fi,Steven Spielberg,7.8
1528,Intimate Relations (1996),Comedy,"Al Pacino, Scarlett Johansson, Morgan Freeman",4.4
1529,Nowhere (1997),Comedy|Drama,"Audrey Hepburn, Tom Cruise, Clint Eastwood",5.2
1531,Losing Chase (1996),Drama,"Angelina Jolie, Scarlett Johansson",3.1
1532,Sprung (1997),Comedy,Christopher Nolan,5.3
1533,"Promise, The (La promesse) (1996)",Drama,"Steven Spielberg, Scarlett Johansson",8.1
1534,"Bonheur, Le (1965)",Drama,"Scarlett Johansson, Robert De Niro, Morgan Freeman",8.9
1535,Love! Valour! Compassion! (1997),Drama|Romance,"Jennifer Lawrence, Denzel Washington",4.1
1537,Shall We Dance? (Shall We Dansu?) (1996),Comedy|Drama|Romance,"Emma Watson, Steven Spielberg",5.7
1538,"Second Jungle Book: Mowgli & Baloo, The (1997)",Adventure|Children,"Al Pacino, Scarlett Johansson",7.5
1539,Twin Town (1997),Comedy|Crime,Christopher Nolan,3.7
1541,Addicted to Love (1997),Comedy|Romance,"Johnny Depp, Leonardo DiCaprio, Tom Cruise",8.9
1542,Brassed Off (1996),Comedy|Drama|Romance,"Robert De Niro, Tom Cruise",5.1
1543,"Designated Mourner, The (1997)",Drama,"Steven Spielberg, Clint Eastwood",4.0
1544,"Lost World: Jurassic Park, The (1997)",Action|Adventure|Sci-Fi|Thriller,Morgan Freeman,7.1
1545,Ponette (1996),Drama,"Morgan Freeman, Al Pacino, Jennifer Lawrence",9.9
1546,Schizopolis (1996),Comedy,Christopher Nolan,5.4
1547,Shiloh (1997),Children|Drama,"Christopher Nolan, Tom Cruise",3.3
1548,"War at Home, The (1996)",Drama,Morgan Freeman,6.7
1549,Rough Magic (1995),Drama|Romance,"Meryl Streep, Steven Spielberg",8.2
1550,Trial and Error (1997),Comedy|Romance,Christopher Nolan,7.0
1551,Buddy (1997),Adventure|Children|Drama,Audrey Hepburn,4.0
1552,Con Air (1997),Action|Adventure|Thriller,"Scarlett Johansson, Denzel Washington",7.9
1553,Late Bloomers (1996),Comedy,"Scarlett Johansson, Steven Spielberg",9.0
1554,"Pillow Book, The (1996)",Drama|Romance,Jennifer Lawrence,3.0
1555,"To Have, or Not (En avoir (ou pas)) (1995)",Drama,"Emma Watson, Clint Eastwood",6.0
1556,Speed 2: Cruise Control (1997),Action|Romance|Thriller,"Scarlett Johansson, Audrey Hepburn, Meryl Streep",6.7
1557,Squeeze (1997),Drama,"Angelina Jolie, Denzel Washington, Scarlett Johansson",4.9
1558,Sudden Manhattan (1997),Comedy,Robert De Niro,3.8
1559,"Next Step, The (1997)",Drama,"Clint Eastwood, Tom Hanks, Audrey Hepburn",8.1
1561,Wedding Bell Blues (1996),Comedy,"Emma Watson, Steven Spielberg",7.3
1562,Batman & Robin (1997),Action|Adventure|Fantasy|Thriller,Al Pacino,4.9
1563,Dream With the Fishes (1997),Drama,Tom Hanks,4.7
1564,For Roseanna (Roseanna's Grave) (1997),Comedy|Drama|Romance,"Clint Eastwood, Emma Watson",9.5
1565,Head Above Water (1996),Comedy|Thriller,"Al Pacino, Angelina Jolie, Johnny Depp",8.9
1566,Hercules (1997),Adventure|Animation|Children|Comedy|Musical,"Brad Pitt, Meryl Streep, Robert De Niro",9.0
1567,The Last Time I Committed Suicide (1997),Drama,"Denzel Washington, Tom Cruise",3.6
1568,MURDER and murder (1996),Crime|Drama|Mystery,Denzel Washington,5.9
1569,My Best Friend's Wedding (1997),Comedy|Romance,Leonardo DiCaprio,4.9
1570,Tetsuo II: Body Hammer (1992),Horror|Sci-Fi,"Emma Watson, Tom Cruise, Robert De Niro",5.2
1571,When the Cat's Away (Chacun cherche son chat) (1996),Comedy|Romance,"Scarlett Johansson, Tom Hanks",9.2
1572,"Contempt (Mépris, Le) (1963)",Drama,"Angelina Jolie, Martin Scorsese, Al Pacino",4.6
1573,Face/Off (1997),Action|Crime|Drama|Thriller,"Martin Scorsese, Tom Cruise",3.8
1574,Fall (1997),Romance,"Martin Scorsese, Robert De Niro",6.7
1575,Gabbeh (1996),Drama,"Brad Pitt, Audrey Hepburn, Tom Cruise",8.8
1577,Mondo (1996),Drama,Clint Eastwood,5.9
1578,"Innocent Sleep, The (1996)",Crime,"Jack Nicholson, Tom Cruise",7.7
1579,For Ever Mozart (1996),Drama,Angelina Jolie,8.3
1580,Men in Black (a.k.a. MIB) (1997),Action|Comedy|Sci-Fi,Al Pacino,4.0
1581,Out to Sea (1997),Comedy,Leonardo DiCaprio,7.0
1582,Wild America (1997),Adventure|Children,"Robert De Niro, Clint Eastwood",9.7
1583,"Simple Wish, A (1997)",Children|Fantasy,"Jennifer Lawrence, Martin Scorsese",4.6
1584,Contact (1997),Drama|Sci-Fi,"Audrey Hepburn, Al Pacino, Brad Pitt",3.3
1585,Love Serenade (1996),Comedy,"Emma Watson, Jennifer Lawrence, Al Pacino",5.6
1586,G.I. Jane (1997),Action|Drama,Emma Watson,5.9
1587,Conan the Barbarian (1982),Action|Adventure|Fantasy,"Morgan Freeman, Leonardo DiCaprio, Emma Watson",8.3
1588,George of the Jungle (1997),Children|Comedy,"Robert De Niro, Leonardo DiCaprio, Morgan Freeman",8.2
1589,Cop Land (1997),Action|Crime|Drama|Thriller,Johnny Depp,8.5
1590,Event Horizon (1997),Horror|Sci-Fi|Thriller,"Al Pacino, Scarlett Johansson, Denzel Washington",3.1
1591,Spawn (1997),Action|Adventure|Sci-Fi|Thriller,"Jennifer Lawrence, Tom Hanks, Tom Cruise",10.0
1592,Air Bud (1997),Children|Comedy,"Morgan Freeman, Tom Cruise, Martin Scorsese",4.4
1593,Picture Perfect (1997),Comedy|Romance,Steven Spielberg,4.1
1594,In the Company of Men (1997),Comedy|Drama,"Jennifer Lawrence, Christopher Nolan, Clint Eastwood",7.9
1595,Free Willy 3: The Rescue (1997),Adventure|Children|Drama,"Morgan Freeman, Angelina Jolie",3.9
1596,Career Girls (1997),Drama,Angelina Jolie,3.7
1597,Conspiracy Theory (1997),Drama|Mystery|Romance|Thriller,Tom Hanks,5.8
1598,Desperate Measures (1998),Crime|Drama|Thriller,Martin Scorsese,5.6
1599,Steel (1997),Action,"Al Pacino, Tom Hanks, Steven Spielberg",3.2
1600,She's So Lovely (1997),Drama|Romance,"Angelina Jolie, Meryl Streep",9.2
1601,Hoodlum (1997),Crime|Drama|Film-Noir,Jennifer Lawrence,4.1
1602,Leave It to Beaver (1997),Comedy,Tom Hanks,7.6
1603,Mimic (1997),Horror|Sci-Fi|Thriller,"Tom Hanks, Morgan Freeman",3.3
1604,Money Talks (1997),Action|Comedy,"Brad Pitt, Emma Watson, Tom Cruise",7.2
1605,Excess Baggage (1997),Adventure|Romance,Angelina Jolie,3.2
1606,Kull the Conqueror (1997),Action|Adventure,"Scarlett Johansson, Brad Pitt, Jennifer Lawrence",8.0
1608,Air Force One (1997),Action|Thriller,"Meryl Streep, Leonardo DiCaprio",9.1
1609,187 (One Eight Seven) (1997),Drama|Thriller,"Al Pacino, Jennifer Lawrence, Steven Spielberg",4.9
1610,"Hunt for Red October, The (1990)",Action|Adventure|Thriller,Steven Spielberg,5.4
1611,My Own Private Idaho (1991),Drama|Romance,Tom Hanks,7.3
1612,"Kiss Me, Guido (1997)",Comedy,Meryl Streep,4.1
1613,Star Maps (1997),Drama,"Robert De Niro, Steven Spielberg, Meryl Streep",5.5
1614,In & Out (1997),Comedy,"Meryl Streep, Jack Nicholson",8.8
1615,"Edge, The (1997)",Adventure|Drama,"Jennifer Lawrence, Morgan Freeman",9.4
1616,"Peacemaker, The (1997)",Action|Thriller|War,"Clint Eastwood, Tom Cruise, Martin Scorsese",4.3
1617,L.A. Confidential (1997),Crime|Film-Noir|Mystery|Thriller,"Denzel Washington, Robert De Niro, Scarlett Johansson",3.3
1619,Seven Years in Tibet (1997),Adventure|Drama|War,Leonardo DiCaprio,8.5
1620,Kiss the Girls (1997),Crime|Drama|Mystery|Thriller,"Tom Cruise, Denzel Washington",6.4
1621,Soul Food (1997),Drama,"Tom Hanks, Al Pacino, Leonardo DiCaprio",6.3
1622,Kicked in the Head (1997),Comedy|Drama,Martin Scorsese,8.2
1623,Wishmaster (1997),Horror,"Robert De Niro, Steven Spielberg, Denzel Washington",9.2
1624,"Thousand Acres, A (1997)",Drama,Denzel Washington,10.0
1625,"Game, The (1997)",Drama|Mystery|Thriller,"Leonardo DiCaprio, Brad Pitt, Martin Scorsese",5.8
1626,Fire Down Below (1997),Action|Drama|Thriller,Christopher Nolan,4.0
1627,U Turn (1997),Crime|Drama|Mystery,Tom Cruise,7.3
1628,"Locusts, The (1997)",Drama,"Angelina Jolie, Morgan Freeman, Robert De Niro",4.7
1629,"MatchMaker, The (1997)",Comedy|Romance,"Jennifer Lawrence, Meryl Streep",6.9
1630,"Lay of the Land, The (1997)",Comedy|Drama,"Johnny Depp, Martin Scorsese",9.5
1631,"Assignment, The (1997)",Action|Thriller,"Morgan Freeman, Tom Cruise",5.7
1632,"Smile Like Yours, A (1997)",Comedy|Romance,"Clint Eastwood, Johnny Depp, Denzel Washington",8.3
1633,Ulee's Gold (1997),Drama,"Tom Cruise, Audrey Hepburn, Johnny Depp",6.9
1635,"Ice Storm, The (1997)",Drama,"Meryl Streep, Brad Pitt",4.7
1636,Stag (1997),Action|Thriller,"Clint Eastwood, Jack Nicholson",3.1
1639,Chasing Amy (1997),Comedy|Drama|Romance,"Christopher Nolan, Clint Eastwood, Steven Spielberg",9.6
